Project,PNumber,CreatedAt,ClosedAt,isMerged,MergedAt,MergedCommit,nFiles,nCommits,Commits,Labels,Title,Body
linux-can/can-utils,319,2021-10-21T09:22:58Z,2021-10-21T09:24:12Z,True,2021-10-21T09:24:12Z,607b643e0fc311f058b298d0ffb2efdf9468c4f2,1,1,eb0eb7889623491ef988a4d754094034ce948eff,,j1939cat properly fix printf format string to work both on 32 and 64 bit systems,Fixes: 7b8457ce9f79 ("j1939cat: fix long long unsigned int warning in x_name printf")  Fixes: cc155d2f63da ("j1939cat: make use of new RX UAPI")  Signed-off-by: Marc Kleine-Budde <mkl@pengutronix.de>
linux-can/can-utils,318,2021-10-19T13:26:27Z,2021-10-25T13:33:09Z,True,2021-10-25T13:33:09Z,ab9bd4f287ba9782f18836c7a56bf0af479f21aa,1,1,2dde06801abc22be0e617525170783d8d9de7ecc,,canfdtest enables program use alongside existing CAN bus traffic,This change enables the use of this app alongside the traffic  typically found on a CAN bus.
linux-can/can-utils,320,2021-11-14T12:40:23Z,2021-11-14T12:40:31Z,False,none,736dd951ab55b5a6f4ef832652eafbb4bf8bdd2e,1,1,d21a7e03e10fbd826b9fd6346f27d63c1a91599b,,Create codeql analysis yml,none
linux-can/can-utils,325,2021-12-16T02:01:08Z,2021-12-16T09:05:09Z,True,2021-12-16T09:05:09Z,6bd7ced052080998b18ce04dac895a4011a05ffa,1,1,7dd714907b3a90eb9e8a30cf049cfeb1f602ff4f,,mcp251xfd add missing libgen h header,Needed for the basename() function under musl.
linux-can/can-utils,327,2021-12-16T02:08:21Z,2021-12-16T09:04:04Z,True,2021-12-16T09:04:04Z,9ca68a12c799c7d37db7ed84d9954a943963c94d,1,1,eb9cfac9543b1d0e38164e3bcd30086c840a106c,,use PRIx64,This is the proper specifier for uint64_t.
